{
  "knowledgeSuggestions": [],
  "analysis": "根因在 calc.py:9：average 直接除以 len(values)。空列表时提前返回 0 即可，非空列表的路径不变。补一条空列表的测试。",
  "summary": "average 在 values 为空时返回 0，并补测试",
  "hypothesis": {
    "cause": "average 没有处理空列表，len(values) 为 0 时除以零",
    "evidence": [
      {
        "location": "calc.py:9",
        "fact": "return total(values) / len(values) 没有判断空列表"
      }
    ],
    "edits": [
      {
        "location": "calc.py:8-9",
        "change": "values 为空时返回 0"
      }
    ]
  },
  "steps": [
    {
      "file": "calc.py",
      "change": "average 开头判断 values 为空时返回 0",
      "verification": "average([]) 返回 0"
    },
    {
      "file": "tests/test_calc.py",
      "change": "新增 test_average_empty",
      "verification": "pytest 通过"
    }
  ],
  "files": [
    {
      "path": "calc.py",
      "isNew": false,
      "reason": "修复根因"
    },
    {
      "path": "tests/test_calc.py",
      "isNew": false,
      "reason": "补空列表的测试"
    }
  ],
  "estimate": {
    "files": 1,
    "lines": 2
  },
  "oversize": null,
  "blockedBy": null,
  "protectedTouches": [],
  "flags": {
    "design": {
      "flagged": false,
      "reason": null
    },
    "dataStructure": {
      "flagged": false,
      "reason": null
    },
    "publicContract": {
      "flagged": false,
      "reason": null
    }
  },
  "migration": null,
  "newDependencies": [],
  "deletions": [],
  "acceptanceMapping": [
    {
      "criterion": "average([]) 返回 0",
      "steps": [
        1,
        2
      ]
    },
    {
      "criterion": "average([1, 2, 3]) 仍返回 2",
      "steps": [
        1
      ]
    }
  ],
  "userVisibleChange": "average([]) 返回 0，不再抛出异常",
  "affectedEndpoints": [],
  "affectedPages": [],
  "notDoing": [
    "不改 total"
  ],
  "userDecisions": []
}
